{
  "$schema": "http://json-schema.org/draft-07/schema#",
  "type": "object",
  "required": [
    "APP_ENV",
    "APP_DEBUG",
    "INSTAPAPER_CONSUMER_KEY",
    "INSTAPAPER_CONSUMER_SECRET",
    "INSTAPAPER_ACCESS_TOKEN",
    "INSTAPAPER_ACCESS_TOKEN_SECRET",
    "STORAGE_BUCKET_NAME",
    "GCP_PROJECT_ID"
  ],
  "properties": {
    "APP_ENV": {
      "type": "string",
      "enum": ["development", "production", "test"],
      "description": "Application environment"
    },
    "APP_DEBUG": {
      "type": "boolean",
      "description": "Debug mode flag"
    },
    "INSTAPAPER_CONSUMER_KEY": {
      "type": "string",
      "pattern": "^[a-zA-Z0-9]+$",
      "minLength": 10,
      "description": "Instapaper OAuth consumer key"
    },
    "INSTAPAPER_CONSUMER_SECRET": {
      "type": "string",
      "pattern": "^[a-zA-Z0-9]+$",
      "minLength": 10,
      "description": "Instapaper OAuth consumer secret"
    },
    "INSTAPAPER_ACCESS_TOKEN": {
      "type": "string",
      "pattern": "^[a-zA-Z0-9]+$",
      "minLength": 10,
      "description": "Instapaper OAuth access token"
    },
    "INSTAPAPER_ACCESS_TOKEN_SECRET": {
      "type": "string",
      "pattern": "^[a-zA-Z0-9]+$",
      "minLength": 10,
      "description": "Instapaper OAuth access token secret"
    },
    "STORAGE_BUCKET_NAME": {
      "type": "string",
      "pattern": "^[a-z0-9][a-z0-9._-]{1,61}[a-z0-9]$",
      "description": "Google Cloud Storage bucket name"
    },
    "GCP_PROJECT_ID": {
      "type": "string",
      "pattern": "^[a-z][a-z0-9-]{4,28}[a-z0-9]$",
      "description": "Google Cloud project ID"
    },
    "GOOGLE_APPLICATION_CREDENTIALS": {
      "type": "string",
      "description": "Path to Google Cloud credentials JSON file"
    }
  }
}