{
  "APP_ENV": "test",
  "APP_DEBUG": true,
  "INSTAPAPER_CONSUMER_KEY": "test_consumer_key",
  "INSTAPAPER_CONSUMER_SECRET": "test_consumer_secret",
  "INSTAPAPER_ACCESS_TOKEN": "test_access_token",
  "INSTAPAPER_ACCESS_TOKEN_SECRET": "test_access_token_secret",
  "STORAGE_BUCKET_NAME": "test-bucket",
  "GCP_PROJECT_ID": "test-project",
  "GOOGLE_APPLICATION_CREDENTIALS": "/dev/null"
}